{"authority":{"declaration":"Invented fixture data generated solely for software mechanics tests.","recorded_at":"2000-01-01T00:00:00Z"},"blocks":[],"coaching":{"notes":"No coaching system was involved.","state":"disabled"},"collection_classification":"observational","collection_record_id":"synthetic-apex-session-collection-v1","created_at":"2000-01-01T00:00:00Z","dataset_id":"synthetic-apex-session-v1","deviations":[],"lap_assignments":[],"operator_notes":["Scientifically inconclusive and non-implementable."],"participant":{"direct_identity_in_record":false,"external_identity_map_reference":null,"pseudonymous_participant_id":"synthetic-driver"},"privacy":{"classification":"synthetic","direct_identifiers_present":false,"pseudonymized":false},"protocol":null,"schema_version":"apex-labs.collection-record/v1","session_condition":"synthetic mechanics only","session_identity":{"car":"synthetic-car","confirmation_method":"Invented fixture contract","layout":"synthetic-layout","simulator":"SyntheticSim","track":"synthetic-track"},"source_bundle":{"schema_version":"apex-session-export/1.0.0","sha256":"706cbb07254190ea8b61985a5220a74c54f5bccae3286c5203a78365d83b63e4"},"storage":{"retention_declaration":"Retain as a tiny versioned synthetic fixture.","source_bundle_location":"external_untracked"},"synthetic":true,"version":"1.0.0"}
